{
  "id": "component.select",
  "family": "en-ui",
  "status": "beta",
  "maturity": {
    "previousStatus": "external",
    "since": "0.3.0"
  },
  "documentation": "src/components/select/README.md",
  "exports": [
    "selectVariants",
    "Select",
    "SelectTrigger",
    "SelectValue",
    "SelectPopupProps",
    "SelectPopup",
    "SelectItem",
    "SelectSeparator",
    "SelectGroup",
    "SelectLabel",
    "SelectGroupLabel"
  ],
  "publicParts": ["root"],
  "behaviorOwner": {
    "kind": "protected-adapter",
    "owner": "@enosta/en-ui",
    "capabilities": ["native-semantics", "keyboard-interaction"]
  },
  "anatomy": {
    "structure": "<Select>Content</Select>",
    "parts": [
      {
        "part": "root",
        "description": "Root element or behavior owner for the component."
      }
    ]
  },
  "slots": [
    {
      "name": "children",
      "required": false,
      "description": "Component content where supported."
    }
  ],
  "props": [],
  "states": ["default"],
  "requiredStories": ["Basic"],
  "requiredTests": ["renders", "class-name"],
  "tokens": {
    "required": [
      "color.brand.400",
      "color.brand.500",
      "color.error.400",
      "color.error.500",
      "color.neutral.100",
      "color.neutral.200",
      "color.neutral.50",
      "color.neutral.500",
      "color.neutral.600",
      "color.neutral.900",
      "color.surface",
      "radius.control",
      "shadow.hairline",
      "shadow.overlay",
      "shadow.surface",
      "space.3xl",
      "space.5xl",
      "space.6xl",
      "space.lg",
      "space.md",
      "space.sm",
      "space.xl",
      "space.xs"
    ]
  },
  "componentVariables": {
    "customizable": [],
    "protected": ["--anchor-width", "--available-height", "--transform-origin"]
  },
  "rules": ["component.select.preserve-semantics"],
  "migration": {
    "introducedIn": "0.3.0",
    "classification": "compatible",
    "notes": "Styles mapped to En UI theme variables."
  }
}
