{
  "id": "component.separator",
  "family": "en-ui",
  "status": "beta",
  "maturity": {
    "previousStatus": "external",
    "since": "0.3.0"
  },
  "documentation": "src/components/separator/README.md",
  "exports": ["separatorVariants", "SeparatorProps", "Separator"],
  "publicParts": ["root"],
  "behaviorOwner": {
    "kind": "protected-adapter",
    "owner": "@enosta/en-ui",
    "capabilities": ["native-semantics"]
  },
  "anatomy": {
    "structure": "<Separator />",
    "parts": [
      {
        "part": "root",
        "description": "Non-interactive separator element rendered by the Base UI adapter."
      }
    ]
  },
  "slots": [
    {
      "name": "children",
      "required": false,
      "description": "Component content where supported."
    }
  ],
  "props": [
    {
      "name": "orientation",
      "kind": "enum",
      "description": "Orientation of the separator line.",
      "values": ["horizontal", "vertical"],
      "default": "horizontal"
    }
  ],
  "states": ["default"],
  "requiredStories": ["Overview"],
  "requiredTests": ["renders", "class-name"],
  "tokens": {
    "required": ["color.neutral.200"]
  },
  "componentVariables": {
    "customizable": [],
    "protected": []
  },
  "rules": ["component.separator.preserve-semantics"],
  "migration": {
    "introducedIn": "0.3.0",
    "classification": "compatible",
    "notes": "Styles mapped to En UI theme variables."
  }
}
