{
  "id": "component.spinner",
  "family": "en-ui",
  "status": "beta",
  "maturity": {
    "previousStatus": "external",
    "since": "0.3.0"
  },
  "documentation": "src/components/spinner/README.md",
  "exports": ["SpinnerProps", "Spinner"],
  "publicParts": ["root"],
  "behaviorOwner": {
    "kind": "native",
    "owner": "@enosta/en-ui",
    "capabilities": ["native-semantics"]
  },
  "anatomy": {
    "structure": "<Spinner>Content</Spinner>",
    "parts": [
      {
        "part": "root",
        "description": "Root element or behavior owner for the component."
      }
    ]
  },
  "slots": [
    {
      "name": "children",
      "required": false,
      "description": "Component content where supported."
    }
  ],
  "props": [],
  "states": ["default"],
  "requiredStories": ["Basic"],
  "requiredTests": ["renders", "class-name"],
  "tokens": {
    "required": ["space.3xl"]
  },
  "componentVariables": {
    "customizable": [],
    "protected": []
  },
  "rules": ["component.spinner.preserve-semantics"],
  "migration": {
    "introducedIn": "0.3.0",
    "classification": "compatible",
    "notes": "Styles mapped to En UI theme variables."
  }
}
